npi,name,state,billing_state,hcpcs_code,hcpcs_description,hcpcs_drug_ind,place_of_service,services_2023,beneficiaries_2023,avg_paid_per_service,avg_allowed_per_service,avg_submitted_charge,estimated_paid_total,provider_type,exclusion_source,exclusion_effective_year,post_exclusion_2023_billing,score,leie_lookup_url,sam_lookup_url,nppes_lookup_url
1871708180,"LANKFORD, LADARYL",AR,AR,99232,"Subsequent hospital care with moderate levelof medical decision making, if using time, at least 35 minutes",N,F,761,302,56.73,72.62,108.02,43171.48,Internal Medicine,oig_excluded,2026,no,1.5,https://exclusions.oig.hhs.gov/,https://sam.gov/search/?index=ex,https://npiregistry.cms.hhs.gov/provider-view/1871708180
1871708180,"LANKFORD, LADARYL",AR,AR,99233,"Subsequent hospital care with moderate levelof medical decision making, if using time, at least 50 minutes",N,F,387,174,85.17,108.48,154.0,32958.98,Internal Medicine,oig_excluded,2026,no,1.5,https://exclusions.oig.hhs.gov/,https://sam.gov/search/?index=ex,https://npiregistry.cms.hhs.gov/provider-view/1871708180
1871708180,"LANKFORD, LADARYL",AR,AR,99239,"Hospital discharge day management, more than 30 minutes",N,F,273,255,82.71,104.58,159.0,22580.29,Internal Medicine,oig_excluded,2026,no,1.5,https://exclusions.oig.hhs.gov/,https://sam.gov/search/?index=ex,https://npiregistry.cms.hhs.gov/provider-view/1871708180
1871708180,"LANKFORD, LADARYL",AR,AR,99291,"Critical care, first 30-74 minutes",N,F,90,32,152.33,194.84,425.0,13709.36,Internal Medicine,oig_excluded,2026,no,1.5,https://exclusions.oig.hhs.gov/,https://sam.gov/search/?index=ex,https://npiregistry.cms.hhs.gov/provider-view/1871708180
1871708180,"LANKFORD, LADARYL",AR,AR,99223,"Initial hospital care with moderate level of medical decision making, if using time, at least 75 minutes",N,F,30,29,127.43,159.94,298.0,3822.9,Internal Medicine,oig_excluded,2026,no,1.5,https://exclusions.oig.hhs.gov/,https://sam.gov/search/?index=ex,https://npiregistry.cms.hhs.gov/provider-view/1871708180
1871708180,"LANKFORD, LADARYL",AR,AR,99222,"Initial hospital care with straightforward or low-level medical decision making, if using time, at least 55 minutes",N,F,41,41,89.29,119.73,203.41,3660.99,Internal Medicine,oig_excluded,2026,no,1.5,https://exclusions.oig.hhs.gov/,https://sam.gov/search/?index=ex,https://npiregistry.cms.hhs.gov/provider-view/1871708180
1710381082,"FAULKNER, BRANDON",AR,AR,99214,"Established patient office or other outpatient visit, 30-39 minutes",N,O,48,33,67.48,98.41,334.35,3239.12,Nurse Practitioner,oig_excluded,2025,no,1.5,https://exclusions.oig.hhs.gov/,https://sam.gov/search/?index=ex,https://npiregistry.cms.hhs.gov/provider-view/1710381082
