npi,name,state,billing_state,hcpcs_code,hcpcs_description,hcpcs_drug_ind,place_of_service,services_2023,beneficiaries_2023,avg_paid_per_service,avg_allowed_per_service,avg_submitted_charge,estimated_paid_total,provider_type,exclusion_source,exclusion_effective_year,post_exclusion_2023_billing,score,leie_lookup_url,sam_lookup_url,nppes_lookup_url
1740275676,"HESS, DAVID",WV,WV,99215,"Established patient office or other outpatient visit, 40-54 minutes",N,O,69,58,71.65,169.32,240.0,4944.06,Family Practice,oig_excluded,2026,no,1.5,https://exclusions.oig.hhs.gov/,https://sam.gov/search/?index=ex,https://npiregistry.cms.hhs.gov/provider-view/1740275676
1740275676,"HESS, DAVID",WV,WV,99214,"Established patient office or other outpatient visit, 30-39 minutes",N,O,71,58,46.23,119.53,185.0,3282.1,Family Practice,oig_excluded,2026,no,1.5,https://exclusions.oig.hhs.gov/,https://sam.gov/search/?index=ex,https://npiregistry.cms.hhs.gov/provider-view/1740275676
1740275676,"HESS, DAVID",WV,WV,99233,"Subsequent hospital care with moderate levelof medical decision making, if using time, at least 50 minutes",N,F,25,12,91.3,114.59,200.0,2282.5,Family Practice,oig_excluded,2026,no,1.5,https://exclusions.oig.hhs.gov/,https://sam.gov/search/?index=ex,https://npiregistry.cms.hhs.gov/provider-view/1740275676
1740275676,"HESS, DAVID",WV,WV,99232,"Subsequent hospital care with moderate levelof medical decision making, if using time, at least 35 minutes",N,F,31,13,60.67,76.15,175.0,1880.77,Family Practice,oig_excluded,2026,no,1.5,https://exclusions.oig.hhs.gov/,https://sam.gov/search/?index=ex,https://npiregistry.cms.hhs.gov/provider-view/1740275676
1740275676,"HESS, DAVID",WV,WV,99442,"Telephone medical discussion with physician, 11-20 minutes",N,O,16,15,37.66,84.88,125.0,602.5,Family Practice,oig_excluded,2026,no,1.5,https://exclusions.oig.hhs.gov/,https://sam.gov/search/?index=ex,https://npiregistry.cms.hhs.gov/provider-view/1740275676
